{
  "$schema": "http://json-schema.org/draft-07/schema#",
  "$id": "https://luongnv.com/sleek-ui/schema/design.v1.json",
  "title": "Sleek UI Design System Schema",
  "description": "JSON Schema for Sleek UI design system configuration",
  "type": "object",
  "required": [
    "$schema",
    "name",
    "version",
    "description",
    "categories",
    "tokens",
    "fonts",
    "agentInstructions"
  ],
  "properties": {
    "$schema": {
      "type": "string",
      "pattern": "https://luongnv.com/sleek-ui/schema/design.v1.json"
    },
    "name": {
      "type": "string",
      "description": "Unique design name (slug format)"
    },
    "version": {
      "type": "string",
      "pattern": "^\\d+\\.\\d+\\.\\d+$"
    },
    "description": {
      "type": "string",
      "minLength": 10
    },
    "categories": {
      "type": "array",
      "items": { "type": "string" },
      "minItems": 1
    },
    "collection": {
      "type": "string",
      "enum": ["web", "terminal", "coding"],
      "default": "web",
      "description": "Catalog collection: web designs, terminal app themes, or coding app themes"
    },
    "appTargets": {
      "type": "array",
      "items": {
        "type": "string",
        "enum": ["pi", "ghostty", "iterm2", "warp", "opencode", "vscode"]
      },
      "uniqueItems": true,
      "description": "Application targets this theme can be applied to"
    },
    "author": {
      "type": "object",
      "properties": {
        "name": { "type": "string" },
        "email": { "type": "string", "format": "email" },
        "url": { "type": "string", "format": "uri" }
      }
    },
    "tokens": {
      "type": "object",
      "required": ["colors", "typography", "spacing", "radius", "shadows"],
      "properties": {
        "colors": {
          "type": "object",
          "required": ["light", "dark"],
          "properties": {
            "light": {
              "type": "object",
              "required": ["background", "foreground", "primary", "primary-foreground", "secondary", "secondary-foreground", "muted", "muted-foreground", "accent", "accent-foreground", "destructive", "destructive-foreground", "border", "input", "ring", "card", "card-foreground"],
              "additionalProperties": { "type": "string", "pattern": "^[0-9.]+ [0-9.]+% [0-9.]+%$" }
            },
            "dark": {
              "type": "object",
              "required": ["background", "foreground", "primary", "primary-foreground", "secondary", "secondary-foreground", "muted", "muted-foreground", "accent", "accent-foreground", "destructive", "destructive-foreground", "border", "input", "ring", "card", "card-foreground"],
              "additionalProperties": { "type": "string", "pattern": "^[0-9.]+ [0-9.]+% [0-9.]+%$" }
            }
          }
        },
        "typography": {
          "type": "object",
          "required": ["fontFamily", "fontSize", "fontWeight", "lineHeight", "letterSpacing"],
          "properties": {
            "fontFamily": {
              "type": "object",
              "properties": {
                "sans": { "type": "string" },
                "serif": { "type": "string" },
                "mono": { "type": "string" }
              }
            },
            "fontSize": {
              "type": "object",
              "properties": {
                "xs": { "type": "string" },
                "sm": { "type": "string" },
                "base": { "type": "string" },
                "lg": { "type": "string" },
                "xl": { "type": "string" },
                "2xl": { "type": "string" },
                "3xl": { "type": "string" },
                "4xl": { "type": "string" }
              }
            },
            "fontWeight": {
              "type": "object",
              "properties": {
                "normal": { "type": "integer" },
                "medium": { "type": "integer" },
                "semibold": { "type": "integer" },
                "bold": { "type": "integer" }
              }
            },
            "lineHeight": {
              "type": "object",
              "properties": {
                "tight": { "type": "string" },
                "normal": { "type": "string" },
                "relaxed": { "type": "string" }
              }
            },
            "letterSpacing": {
              "type": "object",
              "properties": {
                "tight": { "type": "string" },
                "normal": { "type": "string" },
                "wide": { "type": "string" }
              }
            }
          }
        },
        "spacing": {
          "type": "object",
          "required": ["unit"],
          "properties": {
            "unit": { "type": "string" },
            "xs": { "type": "string" },
            "sm": { "type": "string" },
            "md": { "type": "string" },
            "lg": { "type": "string" },
            "xl": { "type": "string" },
            "2xl": { "type": "string" }
          }
        },
        "radius": {
          "type": "object",
          "required": ["sm", "default", "lg", "full"],
          "properties": {
            "sm": { "type": "string" },
            "default": { "type": "string" },
            "lg": { "type": "string" },
            "full": { "type": "string" }
          }
        },
        "shadows": {
          "type": "object",
          "properties": {
            "sm": { "type": "string" },
            "default": { "type": "string" },
            "lg": { "type": "string" }
          }
        },
        "motion": {
          "type": "object",
          "description": "Animation and motion tokens — durations, delays, easings, iterations, keyframes, and interaction effects. Optional; omit when the source has no meaningful motion.",
          "properties": {
            "duration": {
              "type": "object",
              "description": "Named duration scale — CSS duration strings ('150ms', '0.3s') or {value, unit} objects",
              "additionalProperties": {
                "anyOf": [
                  { "type": "string", "pattern": "^[0-9.]+(ms|s)$" },
                  {
                    "type": "object",
                    "required": ["value", "unit"],
                    "properties": {
                      "value": { "type": "number" },
                      "unit": { "type": "string", "enum": ["ms", "s"] }
                    }
                  }
                ]
              }
            },
            "delay": {
              "type": "object",
              "description": "Named delay scale — same value shapes as duration",
              "additionalProperties": {
                "anyOf": [
                  { "type": "string", "pattern": "^[0-9.]+(ms|s)$" },
                  {
                    "type": "object",
                    "required": ["value", "unit"],
                    "properties": {
                      "value": { "type": "number" },
                      "unit": { "type": "string", "enum": ["ms", "s"] }
                    }
                  }
                ]
              }
            },
            "easing": {
              "type": "object",
              "description": "Named easings — CSS keyword/library easing names as strings, or cubic-bezier control points as 4-number arrays (W3C DTCG cubicBezier). Never 'cubic-bezier(...)' function strings.",
              "additionalProperties": {
                "anyOf": [
                  { "type": "string" },
                  { "type": "array", "items": { "type": "number" }, "minItems": 4, "maxItems": 4 }
                ]
              }
            },
            "iteration": {
              "type": "object",
              "description": "Named iteration counts — numbers or strings such as 'infinite'",
              "additionalProperties": {
                "anyOf": [
                  { "type": "number" },
                  { "type": "string" }
                ]
              }
            },
            "keyframes": {
              "type": "object",
              "description": "Named @keyframes rules — {name: {offset: {property: value}}} with offsets like '0%', '50%', 'from', 'to'",
              "additionalProperties": {
                "type": "object",
                "additionalProperties": {
                  "type": "object",
                  "additionalProperties": {
                    "anyOf": [
                      { "type": "string" },
                      { "type": "number" }
                    ]
                  }
                }
              }
            },
            "effects": {
              "type": "array",
              "description": "Transitions and interaction effects — hover, focus, entrance, exit, scroll behaviors",
              "items": {
                "type": "object",
                "required": ["name", "trigger"],
                "properties": {
                  "name": { "type": "string" },
                  "trigger": {
                    "type": "string",
                    "enum": ["hover", "focus", "active", "entrance", "exit", "scroll", "load", "custom"]
                  },
                  "target": { "type": "string", "description": "Element or component the effect applies to (e.g. 'button', 'card', 'nav')" },
                  "properties": {
                    "type": "array",
                    "items": { "type": "string" },
                    "description": "Animated CSS properties, e.g. ['opacity', 'transform']"
                  },
                  "duration": { "type": "string", "description": "Duration token name or CSS duration string" },
                  "delay": { "type": "string", "description": "Delay token name or CSS duration string" },
                  "easing": {
                    "description": "Easing token name, CSS keyword, or cubic-bezier control points",
                    "anyOf": [
                      { "type": "string" },
                      { "type": "array", "items": { "type": "number" }, "minItems": 4, "maxItems": 4 }
                    ]
                  },
                  "iteration": {
                    "anyOf": [
                      { "type": "number" },
                      { "type": "string" }
                    ]
                  },
                  "keyframes": { "type": "string", "description": "Name of a motion.keyframes entry this effect plays" },
                  "description": { "type": "string" }
                }
              }
            }
          }
        }
      }
    },
    "fonts": {
      "type": "object",
      "required": ["urls"],
      "properties": {
        "google": {
          "type": "array",
          "items": {
            "type": "object",
            "properties": {
              "family": { "type": "string" },
              "weights": { "type": "array", "items": { "type": "integer" } }
            }
          }
        },
        "urls": {
          "type": "array",
          "items": {
            "type": "object",
            "properties": {
              "url": { "type": "string", "format": "uri" },
              "format": { "type": "string" },
              "family": { "type": "string" }
            }
          }
        }
      }
    },
    "accessibility": {
      "type": "object",
      "properties": {
        "contrastTarget": { "type": "number" },
        "focusRing": {
          "type": "object",
          "properties": {
            "width": { "type": "string" },
            "color": { "type": "string" },
            "offset": { "type": "string" }
          }
        },
        "reducedMotion": { "type": "boolean" }
      }
    },
    "components": {
      "type": "object",
      "properties": {
        "button": {
          "type": "object",
          "properties": {
            "primary": { "type": "object" },
            "secondary": { "type": "object" },
            "ghost": { "type": "object" }
          }
        },
        "card": { "type": "object" },
        "input": { "type": "object" }
      }
    },
    "tokenColors": {
      "type": "array",
      "description": "Syntax token colors for terminal/coding app themes",
      "items": {
        "type": "object",
        "required": ["scope", "color"],
        "properties": {
          "scope": { "type": "string" },
          "color": { "type": "string" },
          "fontStyle": { "type": "string" }
        }
      }
    },
    "libraries": {
      "type": "array",
      "description": "External libraries required to reproduce the design — animation libraries (gsap, framer-motion, ...), icon packs, renderers. Optional; omit when the design needs no external runtime dependencies.",
      "items": {
        "type": "object",
        "required": ["name", "package", "installCommand", "purpose"],
        "properties": {
          "name": { "type": "string", "description": "Display name, e.g. 'GSAP'" },
          "package": { "type": "string", "description": "npm package name, e.g. 'gsap'" },
          "version": { "type": "string", "description": "Version constraint observed or recommended, e.g. '^3.12.5'" },
          "installCommand": { "type": "string", "description": "Shell command to install, e.g. 'npm install gsap'" },
          "purpose": { "type": "string", "description": "What the library is needed for, e.g. 'scroll-driven entrance animations'" }
        }
      }
    },
    "agentInstructions": {
      "type": "object",
      "required": ["steps"],
      "properties": {
        "defaultMode": {
          "type": "string",
          "enum": ["light", "dark"]
        },
        "steps": {
          "type": "array",
          "items": { "type": "string" },
          "minItems": 1
        }
      }
    },
    "preview": {
      "type": "object",
      "properties": {
        "thumbnail": { "type": "string" },
        "screenshots": {
          "type": "object",
          "properties": {
            "light": { "type": "array", "items": { "type": "string" } },
            "dark": { "type": "array", "items": { "type": "string" } }
          }
        }
      }
    }
  }
}
