{
  "$schema": "https://sleek-ui.design/schema/design.v1.json",
  "name": "editorial-dark",
  "version": "1.0.0",
  "description": "Sophisticated, muted purples with clean typography. A dark editorial aesthetic perfect for content-heavy applications.",
  "categories": ["dark", "minimal"],
  "author": {
    "name": "sleek-ui",
    "email": "hello@sleek-ui.design",
    "url": "https://sleek-ui.design"
  },
  "tokens": {
    "colors": {
      "light": {
        "background": "0 0% 100%",
        "foreground": "240 10% 3.9%",
        "muted": "240 4.8% 95.9%",
        "muted-foreground": "240 3.8% 46.1%",
        "primary": "245 90% 73%",
        "primary-foreground": "0 0% 100%",
        "secondary": "240 4.8% 95.9%",
        "secondary-foreground": "240 10% 3.9%",
        "accent": "240 4.8% 95.9%",
        "accent-foreground": "240 10% 3.9%",
        "destructive": "0 84.2% 60.2%",
        "destructive-foreground": "0 0% 100%",
        "border": "240 5.9% 90%",
        "input": "240 5.9% 90%",
        "ring": "245 90% 73%",
        "card": "0 0% 100%",
        "card-foreground": "240 10% 3.9%",
        "success": "142 71% 45%",
        "success-foreground": "0 0% 100%",
        "warning": "38 92% 50%",
        "warning-foreground": "0 0% 0%",
        "info": "199 89% 48%",
        "info-foreground": "0 0% 100%"
      },
      "dark": {
        "background": "240 33% 14%",
        "foreground": "0 0% 95%",
        "muted": "240 33% 19%",
        "muted-foreground": "240 5% 64.9%",
        "primary": "245 90% 73%",
        "primary-foreground": "0 0% 100%",
        "secondary": "240 33% 19%",
        "secondary-foreground": "0 0% 95%",
        "accent": "240 33% 19%",
        "accent-foreground": "0 0% 95%",
        "destructive": "0 62.8% 30.6%",
        "destructive-foreground": "0 0% 100%",
        "border": "240 33% 22%",
        "input": "240 33% 22%",
        "ring": "245 90% 73%",
        "card": "240 33% 17%",
        "card-foreground": "0 0% 95%",
        "success": "142 70% 50%",
        "success-foreground": "0 0% 0%",
        "warning": "38 92% 56%",
        "warning-foreground": "0 0% 0%",
        "info": "199 89% 55%",
        "info-foreground": "0 0% 0%"
      }
    },
    "typography": {
      "fontFamily": {
        "sans": "Inter",
        "serif": "Inter",
        "mono": "JetBrains Mono"
      },
      "fontSize": {
        "xs": "0.75rem",
        "sm": "0.875rem",
        "base": "1rem",
        "lg": "1.125rem",
        "xl": "1.25rem",
        "2xl": "1.5rem",
        "3xl": "1.875rem",
        "4xl": "2.25rem"
      },
      "fontWeight": {
        "normal": 400,
        "medium": 500,
        "semibold": 600,
        "bold": 700
      },
      "lineHeight": {
        "tight": "1.25",
        "normal": "1.5",
        "relaxed": "1.625"
      },
      "letterSpacing": {
        "tight": "-0.025em",
        "normal": "0",
        "wide": "0.025em"
      }
    },
    "spacing": {
      "unit": "4px",
      "xs": "4px",
      "sm": "8px",
      "md": "16px",
      "lg": "24px",
      "xl": "32px",
      "2xl": "48px"
    },
    "radius": {
      "sm": "0.125rem",
      "default": "0.375rem",
      "lg": "0.5rem",
      "full": "9999px"
    },
    "shadows": {
      "sm": "0 1px 2px 0 rgb(0 0 0 / 0.05)",
      "default": "0 1px 3px 0 rgb(0 0 0 / 0.1), 0 1px 2px -1px rgb(0 0 0 / 0.1)",
      "lg": "0 10px 15px -3px rgb(0 0 0 / 0.1), 0 4px 6px -4px rgb(0 0 0 / 0.1)"
    }
  },
  "fonts": {
    "google": [
      {
        "family": "Inter",
        "weights": [400, 500, 600, 700]
      },
      {
        "family": "JetBrains Mono",
        "weights": [400, 500]
      }
    ],
    "urls": [
      {
        "url": "https://fonts.googleapis.com/css2?family=Inter:wght@400;500;600;700&display=swap",
        "format": "css2",
        "family": "Inter"
      },
      {
        "url": "https://fonts.googleapis.com/css2?family=JetBrains+Mono:wght@400;500&display=swap",
        "format": "css2",
        "family": "JetBrains Mono"
      }
    ]
  },
  "accessibility": {
    "contrastTarget": 4.5,
    "focusRing": {
      "width": "2px",
      "color": "currentColor",
      "offset": "2px"
    },
    "reducedMotion": true
  },
  "components": {
    "button": {
      "primary": {
        "background": "primary",
        "color": "primary-foreground",
        "borderRadius": "radius.default",
        "padding": "spacing.sm spacing.md",
        "fontWeight": "semibold"
      },
      "secondary": {
        "background": "secondary",
        "color": "secondary-foreground",
        "borderRadius": "radius.default",
        "padding": "spacing.sm spacing.md",
        "fontWeight": "medium"
      },
      "ghost": {
        "background": "transparent",
        "color": "foreground",
        "borderRadius": "radius.default",
        "padding": "spacing.sm spacing.md",
        "fontWeight": "medium"
      }
    },
    "card": {
      "background": "card",
      "color": "card-foreground",
      "borderRadius": "radius.lg",
      "padding": "spacing.lg",
      "shadow": "shadows.default",
      "border": "1px solid border"
    },
    "input": {
      "background": "background",
      "color": "foreground",
      "borderRadius": "radius.default",
      "padding": "spacing.sm spacing.md",
      "border": "1px solid input",
      "focusRing": "focusRing",
      "placeholderColor": "muted-foreground"
    }
  },
  "agentInstructions": {
    "steps": [
      "Set CSS custom properties from tokens.colors on :root (light) and .dark (dark mode)",
      "Set --radius from tokens.radius.default",
      "Load fonts by adding the Google Fonts URL from fonts.urls as a <link> tag",
      "Set font-family from tokens.typography.fontFamily",
      "Apply component styles from the components field (Tailwind class names for shadcn projects)",
      "Ensure focus states match accessibility.focusRing specification",
      "Test both light and dark modes"
    ]
  },
  "preview": {
    "thumbnail": "/previews/editorial-dark-thumb.svg",
    "screenshots": {
      "light": ["/previews/editorial-dark-light.svg"],
      "dark": ["/previews/editorial-dark-dark.svg"]
    }
  }
}
